{
  "$schema": "https://raw.githubusercontent.com/EDURange/schema/main/schemas/pack.schema.json",
  "id": "edurange-web-basics",
  "name": "EDURange Web Basics",
  "version": "1.0.0",
  "description": "A collection of basic challenges for EDURange",
  "author": "EDURange Team",
  "license": "MIT",
  "challenges": [
    "challenges/hidden-flag-web-challenge.cdf.json"
  ]
} 